Name,Energy Type,Set Name,Set Code,Card Number,Card Type,HP,Attacks,Weakness,Retreat Cost,Illustrator,Flavor Text,Image URL,Rarity,Pack,Local Image Path
Zebstrika,Lightning,Genetic Apex,A1,106,Pokémon - Stage 1 - Evolves from Blitzle,90,"[{'name': 'Thunder Spear', 'cost': ['L'], 'damage': '0', 'effect': ""This attack does 30 damage to 1 of your opponent's Pokémon.""}]",Fighting,1,Misa Tsutsui,"When this ill-tempered Pokémon runs wild, it shoots lightning from its mane in all directions.",https://limitlesstcg.nyc3.cdn.digitaloceanspaces.com/pocket/A1/A1_106_EN.webp,◊◊,,cards/genetic-apex/106.webp
Tynamo,Lightning,Genetic Apex,A1,107,Pokémon - Basic,30,"[{'name': 'Tiny Charge', 'cost': ['L'], 'damage': '30', 'effect': ''}]",Fighting,1,Asako Ito,"While one alone doesn’t have much power, a chain of many Tynamo can be as powerful as lightning.",https://limitlesstcg.nyc3.cdn.digitaloceanspaces.com/pocket/A1/A1_107_EN.webp,◊,Mewtwo,cards/genetic-apex/107.webp
Eelektrik,Lightning,Genetic Apex,A1,108,Pokémon - Stage 1 - Evolves from Tynamo,80,"[{'name': 'Head Bolt', 'cost': ['L'], 'damage': '40', 'effect': ''}]",Fighting,2,Midori Harada,They coil around foes and shock them with electricity-generating organs that seem simply to be circular patterns.,https://limitlesstcg.nyc3.cdn.digitaloceanspaces.com/pocket/A1/A1_108_EN.webp,◊◊,Mewtwo,cards/genetic-apex/108.webp
Eelektross,Lightning,Genetic Apex,A1,109,Pokémon - Stage 2 - Evolves from Eelektrik,140,"[{'name': 'Thunder Fang', 'cost': ['LLC'], 'damage': '80', 'effect': ""Flip a coin. If heads, your opponent's Active Pokémon is now Paralyzed.""}]",Fighting,3,hatachu,They crawl out of the ocean using their arms. They will attack prey on shore and immediately drag it into the ocean.,https://limitlesstcg.nyc3.cdn.digitaloceanspaces.com/pocket/A1/A1_109_EN.webp,◊◊◊,Mewtwo,cards/genetic-apex/109.webp
Helioptile,Lightning,Genetic Apex,A1,110,Pokémon - Basic,60,"[{'name': 'Tail Whap', 'cost': ['L'], 'damage': '20', 'effect': ''}]",Fighting,1,5ban Graphics,"When spread, the frills on its head act like solar panels, generating the power behind this Pokémon’s electric moves.",https://limitlesstcg.nyc3.cdn.digitaloceanspaces.com/pocket/A1/A1_110_EN.webp,◊,,cards/genetic-apex/110.webp
Heliolisk,Lightning,Genetic Apex,A1,111,Pokémon - Stage 1 - Evolves from Helioptile,90,"[{'name': 'Quick Attack', 'cost': ['CC'], 'damage': '40+', 'effect': 'Flip a coin. If heads, this attack does 40 more damage.'}]",Fighting,1,otumami,One Heliolisk basking in the sun with its frill outspread is all it would take to produce enough electricity to power a city.,https://limitlesstcg.nyc3.cdn.digitaloceanspaces.com/pocket/A1/A1_111_EN.webp,◊,,cards/genetic-apex/111.webp
Pincurchin,Lightning,Genetic Apex,A1,112,Pokémon - Basic,70,"[{'name': 'Thunder Shock', 'cost': ['LL'], 'damage': '30', 'effect': ""Flip a coin. If heads, your opponent's Active Pokémon is now Paralyzed.""}]",Fighting,1,Tika Matsuno,This Pokémon generates electricity when it digests food. It uses its five hard teeth to scrape seaweed off surfaces and eat it.,https://limitlesstcg.nyc3.cdn.digitaloceanspaces.com/pocket/A1/A1_112_EN.webp,◊◊,,cards/genetic-apex/112.webp
Clefairy,Psychic,Genetic Apex,A1,113,Pokémon - Basic,60,"[{'name': 'Slap', 'cost': ['P'], 'damage': '20', 'effect': ''}]",Metal,1,kirisAki,It is said that happiness will come to those who see a gathering of Clefairy dancing under a full moon.,https://limitlesstcg.nyc3.cdn.digitaloceanspaces.com/pocket/A1/A1_113_EN.webp,◊,Pikachu,cards/genetic-apex/113.webp
Clefable,Psychic,Genetic Apex,A1,114,Pokémon - Stage 1 - Evolves from Clefairy,100,"[{'name': 'Magical Shot', 'cost': ['P'], 'damage': '40', 'effect': ''}]",Metal,1,Sanosuke Sakuma,"A timid fairy Pokémon that is rarely seen, it will run and hide the moment it senses people.",https://limitlesstcg.nyc3.cdn.digitaloceanspaces.com/pocket/A1/A1_114_EN.webp,◊◊,Pikachu,cards/genetic-apex/114.webp
Abra,Psychic,Genetic Apex,A1,115,Pokémon - Basic,60,"[{'name': 'Teleport', 'cost': ['C'], 'damage': '0', 'effect': 'Switch this Pokémon with 1 of your Benched Pokémon.'}]",Darkness,1,Aya Kusube,This Pokémon uses its psychic powers while it sleeps. The contents of Abra’s dreams affect the powers that the Pokémon wields.,https://limitlesstcg.nyc3.cdn.digitaloceanspaces.com/pocket/A1/A1_115_EN.webp,◊,Charizard,cards/genetic-apex/115.webp
Kadabra,Psychic,Genetic Apex,A1,116,Pokémon - Stage 1 - Evolves from Abra,80,"[{'name': 'Super Psy Bolt', 'cost': ['PCC'], 'damage': '60', 'effect': ''}]",Darkness,1,Ken Sugimori,"Using its psychic power, Kadabra levitates as it sleeps. It uses its springy tail as a pillow.",https://limitlesstcg.nyc3.cdn.digitaloceanspaces.com/pocket/A1/A1_116_EN.webp,◊◊,Charizard,cards/genetic-apex/116.webp
Alakazam,Psychic,Genetic Apex,A1,117,Pokémon - Stage 2 - Evolves from Kadabra,130,"[{'name': 'Psychic', 'cost': ['PCC'], 'damage': '60+', 'effect': ""This attack does 30 more damage for each Energy attached to your opponent's Active Pokémon.""}]",Darkness,2,Kouki Saitou,"It has an incredibly high level of intelligence. Some say that Alakazam remembers everything that ever happens to it, from birth till death.",https://limitlesstcg.nyc3.cdn.digitaloceanspaces.com/pocket/A1/A1_117_EN.webp,◊◊◊,Charizard,cards/genetic-apex/117.webp
Slowpoke,Psychic,Genetic Apex,A1,118,Pokémon - Basic,70,"[{'name': 'Tail Whap', 'cost': ['PC'], 'damage': '30', 'effect': ''}]",Darkness,2,Miki Tanaka,It is incredibly slow and dopey. It takes five seconds for it to feel pain when under attack.,https://limitlesstcg.nyc3.cdn.digitaloceanspaces.com/pocket/A1/A1_118_EN.webp,◊,,cards/genetic-apex/118.webp
Slowbro,Psychic,Genetic Apex,A1,119,Pokémon - Stage 1 - Evolves from Slowpoke,130,"[{'name': 'Super Psy Bolt', 'cost': ['PPC'], 'damage': '80', 'effect': ''}]",Darkness,3,Kagemaru Himeno,"When a Slowpoke went hunting in the sea, its tail was bitten by a Shellder. That made it evolve into Slowbro.",https://limitlesstcg.nyc3.cdn.digitaloceanspaces.com/pocket/A1/A1_119_EN.webp,◊◊,,cards/genetic-apex/119.webp
Gastly,Psychic,Genetic Apex,A1,120,Pokémon - Basic,60,"[{'name': 'Suffocating Gas', 'cost': ['P'], 'damage': '20', 'effect': ''}]",Darkness,1,Masako Yamashita,"It wraps its opponent in its gas-like body, slowly weakening its prey by poisoning it through the skin.",https://limitlesstcg.nyc3.cdn.digitaloceanspaces.com/pocket/A1/A1_120_EN.webp,◊,Mewtwo,cards/genetic-apex/120.webp
Haunter,Psychic,Genetic Apex,A1,121,Pokémon - Stage 1 - Evolves from Gastly,80,"[{'name': 'Will-O-Wisp', 'cost': ['P'], 'damage': '30', 'effect': ''}]",Darkness,1,Nisata Niso,It likes to lurk in the dark and tap shoulders with a gaseous hand. Its touch causes endless shuddering.,https://limitlesstcg.nyc3.cdn.digitaloceanspaces.com/pocket/A1/A1_121_EN.webp,◊◊,Mewtwo,cards/genetic-apex/121.webp
Gengar,Psychic,Genetic Apex,A1,122,Pokémon - Stage 2 - Evolves from Haunter,130,"[{'name': 'Bother', 'cost': ['P'], 'damage': '50', 'effect': ""Your opponent can't use any Supporter cards from their hand during their next turn.""}]",Darkness,2,Naoyo Kimura,"To steal the life of its target, it slips into the prey’s shadow and silently waits for an opportunity.",https://limitlesstcg.nyc3.cdn.digitaloceanspaces.com/pocket/A1/A1_122_EN.webp,◊◊◊,Mewtwo,cards/genetic-apex/122.webp
Gengar ex,Psychic,Genetic Apex,A1,123,Pokémon - Stage 2 - Evolves from Haunter,170,"[{'name': 'Spooky Shot', 'cost': ['PPP'], 'damage': '100', 'effect': ''}]",Darkness,2,PLANETA CG Works,,https://limitlesstcg.nyc3.cdn.digitaloceanspaces.com/pocket/A1/A1_123_EN.webp,◊◊◊◊,Mewtwo,cards/genetic-apex/123.webp
Drowzee,Psychic,Genetic Apex,A1,124,Pokémon - Basic,70,"[{'name': 'Mumble', 'cost': ['PC'], 'damage': '30', 'effect': ''}]",Darkness,2,Yukiko Baba,It remembers every dream it eats. It rarely eats the dreams of adults because children’s are much tastier.,https://limitlesstcg.nyc3.cdn.digitaloceanspaces.com/pocket/A1/A1_124_EN.webp,◊,Pikachu,cards/genetic-apex/124.webp
Hypno,Psychic,Genetic Apex,A1,125,Pokémon - Stage 1 - Evolves from Drowzee,100,"[{'name': 'Psypunch', 'cost': ['PPC'], 'damage': '50', 'effect': ''}]",Darkness,2,Shigenori Negishi,"When it locks eyes with an enemy, it will use a mix of psi moves, such as Hypnosis and Confusion.",https://limitlesstcg.nyc3.cdn.digitaloceanspaces.com/pocket/A1/A1_125_EN.webp,◊◊◊,Pikachu,cards/genetic-apex/125.webp
Mr. Mime,Psychic,Genetic Apex,A1,126,Pokémon - Basic,80,"[{'name': 'Barrier Attack', 'cost': ['PC'], 'damage': '30', 'effect': ""During your opponent's next turn, this Pokémon takes -20 damage from attacks.""}]",Darkness,1,Kagemaru Himeno,The broadness of its hands may be no coincidence—many scientists believe its palms became enlarged specifically for pantomiming.,https://limitlesstcg.nyc3.cdn.digitaloceanspaces.com/pocket/A1/A1_126_EN.webp,◊◊,Mewtwo,cards/genetic-apex/126.webp
Jynx,Psychic,Genetic Apex,A1,127,Pokémon - Basic,80,"[{'name': 'Psychic', 'cost': ['PC'], 'damage': '30+', 'effect': ""This attack does 20 more damage for each Energy attached to your opponent's Active Pokémon.""}]",Darkness,1,Oswaldo KATO,Its strange cries sound like human language. There are some musicians who compose songs for Jynx to sing.,https://limitlesstcg.nyc3.cdn.digitaloceanspaces.com/pocket/A1/A1_127_EN.webp,◊,Mewtwo,cards/genetic-apex/127.webp
Mewtwo,Psychic,Genetic Apex,A1,128,Pokémon - Basic,120,"[{'name': 'Power Blast', 'cost': ['PPCC'], 'damage': '120', 'effect': 'Discard 2 [P] Energy from this Pokémon.'}]",Darkness,2,kawayoo,It was created by a scientist after years of horrific gene-splicing and DNA-engineering experiments.,https://limitlesstcg.nyc3.cdn.digitaloceanspaces.com/pocket/A1/A1_128_EN.webp,◊◊◊,Mewtwo,cards/genetic-apex/128.webp
Mewtwo ex,Psychic,Genetic Apex,A1,129,Pokémon - Basic,150,"[{'name': 'Psychic Sphere', 'cost': ['PC'], 'damage': '50', 'effect': ''}, {'name': 'Psydrive', 'cost': ['PPCC'], 'damage': '150', 'effect': 'Discard 2 [P] Energy from this Pokémon.'}]",Darkness,2,PLANETA Mochizuki,,https://limitlesstcg.nyc3.cdn.digitaloceanspaces.com/pocket/A1/A1_129_EN.webp,◊◊◊◊,Mewtwo,cards/genetic-apex/129.webp
Ralts,Psychic,Genetic Apex,A1,130,Pokémon - Basic,60,"[{'name': 'Ram', 'cost': ['C'], 'damage': '10', 'effect': ''}]",Darkness,1,Yuka Morii,The horns on its head provide a strong power that enables it to sense people’s emotions.,https://limitlesstcg.nyc3.cdn.digitaloceanspaces.com/pocket/A1/A1_130_EN.webp,◊,Mewtwo,cards/genetic-apex/130.webp
Kirlia,Psychic,Genetic Apex,A1,131,Pokémon - Stage 1 - Evolves from Ralts,80,"[{'name': 'Smack', 'cost': ['PC'], 'damage': '30', 'effect': ''}]",Darkness,1,sowsow,It has a psychic power that enables it to distort the space around it and see into the future.,https://limitlesstcg.nyc3.cdn.digitaloceanspaces.com/pocket/A1/A1_131_EN.webp,◊◊,Mewtwo,cards/genetic-apex/131.webp
Gardevoir,Psychic,Genetic Apex,A1,132,Pokémon - Stage 2 - Evolves from Kirlia,110,"[{'name': 'Psyshot', 'cost': ['PPC'], 'damage': '60', 'effect': ''}]",Darkness,2,Yuu Nishida,"To protect its Trainer, it will expend all its psychic power to create a small black hole.",https://limitlesstcg.nyc3.cdn.digitaloceanspaces.com/pocket/A1/A1_132_EN.webp,◊◊◊,Mewtwo,cards/genetic-apex/132.webp
Woobat,Psychic,Genetic Apex,A1,133,Pokémon - Basic,60,"[{'name': 'Gnaw', 'cost': ['C'], 'damage': '10', 'effect': ''}]",Darkness,1,MAHOU,"While inside a cave, if you look up and see lots of heart-shaped marks lining the walls, it’s evidence that Woobat live there.",https://limitlesstcg.nyc3.cdn.digitaloceanspaces.com/pocket/A1/A1_133_EN.webp,◊,,cards/genetic-apex/133.webp
Swoobat,Psychic,Genetic Apex,A1,134,Pokémon - Stage 1 - Evolves from Woobat,90,"[{'name': 'Heart Stamp', 'cost': ['PC'], 'damage': '60', 'effect': ''}]",Darkness,1,Masakazu Fukuda,"Emitting powerful sound waves tires it out. Afterward, it won’t be able to fly for a little while.",https://limitlesstcg.nyc3.cdn.digitaloceanspaces.com/pocket/A1/A1_134_EN.webp,◊,,cards/genetic-apex/134.webp
Golett,Psychic,Genetic Apex,A1,135,Pokémon - Basic,90,"[{'name': 'Mega Punch', 'cost': ['PCC'], 'damage': '50', 'effect': ''}]",Darkness,3,Kyoko Umemoto,"They were sculpted from clay in ancient times. No one knows why, but some of them are driven to continually line up boulders.",https://limitlesstcg.nyc3.cdn.digitaloceanspaces.com/pocket/A1/A1_135_EN.webp,◊,,cards/genetic-apex/135.webp
Golurk,Psychic,Genetic Apex,A1,136,Pokémon - Stage 1 - Evolves from Golett,140,"[{'name': 'Double Lariat', 'cost': ['PPCC'], 'damage': '100x', 'effect': 'Flip 2 coins. This attack does 100 damage for each heads.'}]",Darkness,4,match,Artillery platforms built into the walls of ancient castles served as perches from which Golurk could fire energy beams.,https://limitlesstcg.nyc3.cdn.digitaloceanspaces.com/pocket/A1/A1_136_EN.webp,◊◊,,cards/genetic-apex/136.webp
Sandshrew,Fighting,Genetic Apex,A1,137,Pokémon - Basic,70,"[{'name': 'Scratch', 'cost': ['F'], 'damage': '10', 'effect': ''}]",Grass,1,Miki Tanaka,"It loves to bathe in the grit of dry, sandy areas. By sand bathing, the Pokémon rids itself of dirt and moisture clinging to its body.",https://limitlesstcg.nyc3.cdn.digitaloceanspaces.com/pocket/A1/A1_137_EN.webp,◊,,cards/genetic-apex/137.webp
Sandslash,Fighting,Genetic Apex,A1,138,Pokémon - Stage 1 - Evolves from Sandshrew,100,"[{'name': 'Slash', 'cost': ['FF'], 'damage': '70', 'effect': ''}]",Grass,2,Miki Tanaka,"The drier the area Sandslash lives in, the harder and smoother the Pokémon’s spikes will feel when touched.",https://limitlesstcg.nyc3.cdn.digitaloceanspaces.com/pocket/A1/A1_138_EN.webp,◊◊,,cards/genetic-apex/138.webp
Diglett,Fighting,Genetic Apex,A1,139,Pokémon - Basic,50,"[{'name': 'Mud-Slap', 'cost': ['F'], 'damage': '20', 'effect': ''}]",Grass,1,Masako Yamashita,"It lives about one yard underground, where it feeds on plant roots. It sometimes appears aboveground.",https://limitlesstcg.nyc3.cdn.digitaloceanspaces.com/pocket/A1/A1_139_EN.webp,◊,Pikachu,cards/genetic-apex/139.webp
Dugtrio,Fighting,Genetic Apex,A1,140,Pokémon - Stage 1 - Evolves from Diglett,70,"[{'name': 'Dig', 'cost': ['F'], 'damage': '40', 'effect': ""Flip a coin. If heads, during your opponent's next turn, prevent all damage from—and effects of—attacks done to this Pokémon.""}]",Grass,1,Akira Komayama,"Its three heads bob separately up and down to loosen the soil nearby, making it easier for it to burrow.",https://limitlesstcg.nyc3.cdn.digitaloceanspaces.com/pocket/A1/A1_140_EN.webp,◊◊,Pikachu,cards/genetic-apex/140.webp
Mankey,Fighting,Genetic Apex,A1,141,Pokémon - Basic,60,"[{'name': 'Low Kick', 'cost': ['F'], 'damage': '20', 'effect': ''}]",Psychic,1,Kanako Eo,"It lives in groups in the treetops. If it loses sight of its group, it becomes infuriated by its loneliness.",https://limitlesstcg.nyc3.cdn.digitaloceanspaces.com/pocket/A1/A1_141_EN.webp,◊,Charizard,cards/genetic-apex/141.webp
Primeape,Fighting,Genetic Apex,A1,142,Pokémon - Stage 1 - Evolves from Mankey,90,"[{'name': 'Fight Back', 'cost': ['FF'], 'damage': '40+', 'effect': 'If this Pokémon has damage on it, this attack does 60 more damage.'}]",Psychic,1,Kagemaru Himeno,It becomes wildly furious if it even senses someone looking at it. It chases anyone that meets its glare.,https://limitlesstcg.nyc3.cdn.digitaloceanspaces.com/pocket/A1/A1_142_EN.webp,◊◊,Charizard,cards/genetic-apex/142.webp
Machop,Fighting,Genetic Apex,A1,143,Pokémon - Basic,70,"[{'name': 'Knuckle Punch', 'cost': ['F'], 'damage': '20', 'effect': ''}]",Psychic,2,Kyoko Umemoto,"Its whole body is composed of muscles. Even though it’s the size of a human child, it can hurl 100 grown-ups.",https://limitlesstcg.nyc3.cdn.digitaloceanspaces.com/pocket/A1/A1_143_EN.webp,◊,Charizard,cards/genetic-apex/143.webp
Machoke,Fighting,Genetic Apex,A1,144,Pokémon - Stage 1 - Evolves from Machop,100,"[{'name': 'Strength', 'cost': ['FF'], 'damage': '50', 'effect': ''}]",Psychic,2,match,"Its muscular body is so powerful, it must wear a power-save belt to be able to regulate its motions.",https://limitlesstcg.nyc3.cdn.digitaloceanspaces.com/pocket/A1/A1_144_EN.webp,◊◊,Charizard,cards/genetic-apex/144.webp
Machamp,Fighting,Genetic Apex,A1,145,Pokémon - Stage 2 - Evolves from Machoke,150,"[{'name': 'Seismic Toss', 'cost': ['FFF'], 'damage': '100', 'effect': ''}]",Psychic,3,Hitoshi Ariga,It quickly swings its four arms to rock its opponents with ceaseless punches and chops from all angles.,https://limitlesstcg.nyc3.cdn.digitaloceanspaces.com/pocket/A1/A1_145_EN.webp,◊◊◊,Charizard,cards/genetic-apex/145.webp
Machamp ex,Fighting,Genetic Apex,A1,146,Pokémon - Stage 2 - Evolves from Machoke,180,"[{'name': 'Mega Punch', 'cost': ['FFF'], 'damage': '120', 'effect': ''}]",Psychic,3,PLANETA CG Works,,https://limitlesstcg.nyc3.cdn.digitaloceanspaces.com/pocket/A1/A1_146_EN.webp,◊◊◊◊,Charizard,cards/genetic-apex/146.webp
Geodude,Fighting,Genetic Apex,A1,147,Pokémon - Basic,70,"[{'name': 'Tackle', 'cost': ['F'], 'damage': '20', 'effect': ''}]",Grass,2,Kouki Saitou,"Geodude that have lived a long life have had all their edges smoothed out until they’re totally round. They also have a calm, quiet disposition.",https://limitlesstcg.nyc3.cdn.digitaloceanspaces.com/pocket/A1/A1_147_EN.webp,◊,Pikachu,cards/genetic-apex/147.webp
Graveler,Fighting,Genetic Apex,A1,148,Pokémon - Stage 1 - Evolves from Geodude,100,"[{'name': 'Rollout', 'cost': ['FCC'], 'damage': '70', 'effect': ''}]",Grass,3,Naoyo Kimura,"It climbs up cliffs as it heads toward the peak of a mountain. As soon as it reaches the summit, it rolls back down the way it came.",https://limitlesstcg.nyc3.cdn.digitaloceanspaces.com/pocket/A1/A1_148_EN.webp,◊◊,Pikachu,cards/genetic-apex/148.webp
Golem,Fighting,Genetic Apex,A1,149,Pokémon - Stage 2 - Evolves from Graveler,160,"[{'name': 'Double-Edge', 'cost': ['FCCC'], 'damage': '150', 'effect': 'This Pokémon also does 50 damage to itself.'}]",Grass,4,Sumiyoshi Kizuki,"When Golem grow old, they stop shedding their shells. Those that have lived a long, long time have shells green with moss.",https://limitlesstcg.nyc3.cdn.digitaloceanspaces.com/pocket/A1/A1_149_EN.webp,◊◊◊,Pikachu,cards/genetic-apex/149.webp
Onix,Fighting,Genetic Apex,A1,150,Pokémon - Basic,110,"[{'name': 'Land Crush', 'cost': ['FFF'], 'damage': '70', 'effect': ''}]",Grass,4,otumami,"As it digs through the ground, it absorbs many hard objects. This is what makes its body so solid.",https://limitlesstcg.nyc3.cdn.digitaloceanspaces.com/pocket/A1/A1_150_EN.webp,◊◊,Pikachu,cards/genetic-apex/150.webp
Cubone,Fighting,Genetic Apex,A1,151,Pokémon - Basic,60,"[{'name': 'Growl', 'cost': ['C'], 'damage': '0', 'effect': ""During your opponent's next turn, attacks used by the Defending Pokémon do -20 damage.""}]",Grass,1,sowsow,"When the memory of its departed mother brings it to tears, its cries echo mournfully within the skull it wears on its head.",https://limitlesstcg.nyc3.cdn.digitaloceanspaces.com/pocket/A1/A1_151_EN.webp,◊,Mewtwo,cards/genetic-apex/151.webp
Marowak,Fighting,Genetic Apex,A1,152,Pokémon - Stage 1 - Evolves from Cubone,100,"[{'name': 'Bone Beatdown', 'cost': ['F'], 'damage': '40', 'effect': ''}]",Grass,1,Shin Nagasawa,"This Pokémon overcame its sorrow to evolve a sturdy new body. Marowak faces its opponents bravely, using a bone as a weapon.",https://limitlesstcg.nyc3.cdn.digitaloceanspaces.com/pocket/A1/A1_152_EN.webp,◊◊,Mewtwo,cards/genetic-apex/152.webp
Marowak ex,Fighting,Genetic Apex,A1,153,Pokémon - Stage 1 - Evolves from Cubone,140,"[{'name': 'Bonemerang', 'cost': ['FF'], 'damage': '80x', 'effect': 'Flip 2 coins. This attack does 80 damage for each heads.'}]",Grass,1,PLANETA Mochizuki,,https://limitlesstcg.nyc3.cdn.digitaloceanspaces.com/pocket/A1/A1_153_EN.webp,◊◊◊◊,Mewtwo,cards/genetic-apex/153.webp
Hitmonlee,Fighting,Genetic Apex,A1,154,Pokémon - Basic,80,"[{'name': 'Stretch Kick', 'cost': ['F'], 'damage': '0', 'effect': ""This attack does 30 damage to 1 of your opponent's Benched Pokémon.""}]",Psychic,1,Yukiko Baba,This amazing Pokémon has an awesome sense of balance. It can kick in succession from any position.,https://limitlesstcg.nyc3.cdn.digitaloceanspaces.com/pocket/A1/A1_154_EN.webp,◊,Mewtwo,cards/genetic-apex/154.webp
Hitmonchan,Fighting,Genetic Apex,A1,155,Pokémon - Basic,80,"[{'name': 'Jab', 'cost': ['F'], 'damage': '30', 'effect': ''}]",Psychic,1,Ken Sugimori,"Its punches slice the air. They are launched at such high speed, even a slight graze could cause a burn.",https://limitlesstcg.nyc3.cdn.digitaloceanspaces.com/pocket/A1/A1_155_EN.webp,◊,Charizard,cards/genetic-apex/155.webp
Rhyhorn,Fighting,Genetic Apex,A1,156,Pokémon - Basic,80,"[{'name': 'Tackle', 'cost': ['FFC'], 'damage': '60', 'effect': ''}]",Grass,3,Midori Harada,"Strong, but not too bright, this Pokémon can shatter even a skyscraper with its charging tackles.",https://limitlesstcg.nyc3.cdn.digitaloceanspaces.com/pocket/A1/A1_156_EN.webp,◊,Mewtwo,cards/genetic-apex/156.webp
Rhydon,Fighting,Genetic Apex,A1,157,Pokémon - Stage 1 - Evolves from Rhyhorn,120,"[{'name': 'Horn Drill', 'cost': ['FFFC'], 'damage': '100', 'effect': ''}]",Grass,4,Masakazu Fukuda,It begins walking on its hind legs after evolution. It can punch holes through boulders with its horn.,https://limitlesstcg.nyc3.cdn.digitaloceanspaces.com/pocket/A1/A1_157_EN.webp,◊◊,Mewtwo,cards/genetic-apex/157.webp
Kabuto,Fighting,Genetic Apex,A1,158,Pokémon - Stage 1 - Evolves from Dome Fossil,90,"[{'name': 'Shell Attack', 'cost': ['F'], 'damage': '40', 'effect': ''}]",Grass,1,sui,"This species is almost entirely extinct. Kabuto molt every three days, making their shells harder and harder.",https://limitlesstcg.nyc3.cdn.digitaloceanspaces.com/pocket/A1/A1_158_EN.webp,◊◊,Charizard,cards/genetic-apex/158.webp
Kabutops,Fighting,Genetic Apex,A1,159,Pokémon - Stage 2 - Evolves from Kabuto,140,"[{'name': 'Leech Life', 'cost': ['F'], 'damage': '50', 'effect': ""Heal from this Pokémon the same amount of damage you did to your opponent's Active Pokémon.""}]",Grass,1,Shin Nagasawa,Kabutops slices its prey apart and sucks out the fluids. The discarded body parts become food for other Pokémon.,https://limitlesstcg.nyc3.cdn.digitaloceanspaces.com/pocket/A1/A1_159_EN.webp,◊◊◊,Charizard,cards/genetic-apex/159.webp
Mienfoo,Fighting,Genetic Apex,A1,160,Pokémon - Basic,60,"[{'name': 'Pound', 'cost': ['C'], 'damage': '20', 'effect': ''}]",Psychic,1,match,"In one minute, a well-trained Mienfoo can chop with its arms more than 100 times.",https://limitlesstcg.nyc3.cdn.digitaloceanspaces.com/pocket/A1/A1_160_EN.webp,◊,Pikachu,cards/genetic-apex/160.webp
Mienshao,Fighting,Genetic Apex,A1,161,Pokémon - Stage 1 - Evolves from Mienfoo,80,"[{'name': 'Spiral Kick', 'cost': ['C'], 'damage': '40', 'effect': ''}]",Psychic,1,Atsuko Nishida,"When Mienshao comes across a truly challenging opponent, it will lighten itself by biting off the fur on its arms.",https://limitlesstcg.nyc3.cdn.digitaloceanspaces.com/pocket/A1/A1_161_EN.webp,◊◊,Pikachu,cards/genetic-apex/161.webp
Clobbopus,Fighting,Genetic Apex,A1,162,Pokémon - Basic,80,"[{'name': 'Knuckle Punch', 'cost': ['FC'], 'damage': '30', 'effect': ''}]",Psychic,2,Yuu Nishida,"It’s very curious, but its means of investigating things is to try to punch them with its tentacles. The search for food is what brings it onto land.",https://limitlesstcg.nyc3.cdn.digitaloceanspaces.com/pocket/A1/A1_162_EN.webp,◊,,cards/genetic-apex/162.webp
Grapploct,Fighting,Genetic Apex,A1,163,Pokémon - Stage 1 - Evolves from Clobbopus,130,"[{'name': 'Knock Back', 'cost': ['FFC'], 'damage': '70', 'effect': ""Switch out your opponent's Active Pokémon to the Bench. (Your opponent chooses the new Active Pokémon.)""}]",Psychic,3,kurumitsu,A body made up of nothing but muscle makes the grappling moves this Pokémon performs with its tentacles tremendously powerful.,https://limitlesstcg.nyc3.cdn.digitaloceanspaces.com/pocket/A1/A1_163_EN.webp,◊◊,,cards/genetic-apex/163.webp
Ekans,Darkness,Genetic Apex,A1,164,Pokémon - Basic,60,"[{'name': 'Bite', 'cost': ['D'], 'damage': '20', 'effect': ''}]",Fighting,1,MAHOU,"By dislocating its jaw, it can swallow prey larger than itself. After a meal, it curls up and rests.",https://limitlesstcg.nyc3.cdn.digitaloceanspaces.com/pocket/A1/A1_164_EN.webp,◊,,cards/genetic-apex/164.webp
Arbok,Darkness,Genetic Apex,A1,165,Pokémon - Stage 1 - Evolves from Ekans,100,"[{'name': 'Corner', 'cost': ['DC'], 'damage': '60', 'effect': ""During your opponent's next turn, the Defending Pokémon can't retreat.""}]",Fighting,2,Naoki Saito,The latest research has determined that there are over 20 possible arrangements of the patterns on its stomach.,https://limitlesstcg.nyc3.cdn.digitaloceanspaces.com/pocket/A1/A1_165_EN.webp,◊◊,,cards/genetic-apex/165.webp
Nidoran♀,Darkness,Genetic Apex,A1,166,Pokémon - Basic,60,"[{'name': 'Call for Family', 'cost': ['D'], 'damage': '0', 'effect': 'Put 1 random Nidoran♂ from your deck onto your Bench.'}]",Fighting,1,Miki Tanaka,"Females are more sensitive to smells than males. While foraging, they’ll use their whiskers to check wind direction and stay downwind of predators.",https://limitlesstcg.nyc3.cdn.digitaloceanspaces.com/pocket/A1/A1_166_EN.webp,◊,Pikachu,cards/genetic-apex/166.webp
