Name,Energy Type,Set Name,Set Code,Card Number,Card Type,HP,Attacks,Weakness,Retreat Cost,Illustrator,Flavor Text,Image URL,Rarity,Pack,Local Image Path
Barry,,Triumphant Light,A2a,74,Trainer - Supporter,,"[{'name': 'Effect', 'cost': [], 'damage': '', 'effect': 'During this turn, attacks used by your Snorlax, Heracross, and Staraptor cost 2 less[C]Energy. Illustrated byHideki Ishikawa'}]",,,Hideki Ishikawa,,https://limitlesstcg.nyc3.cdn.digitaloceanspaces.com/pocket/A2a/A2a_074_EN.webp,◊◊,Arceus,cards/triumphant-light/74.webp
Adaman,,Triumphant Light,A2a,75,Trainer - Supporter,,"[{'name': 'Effect', 'cost': [], 'damage': '', 'effect': ""During your opponent's next turn, all of your[M]Pokémon take −20 damage from attacks from your opponent's Pokémon. Illustrated byakagi""}]",,,akagi,,https://limitlesstcg.nyc3.cdn.digitaloceanspaces.com/pocket/A2a/A2a_075_EN.webp,◊◊,Arceus,cards/triumphant-light/75.webp
Houndoom,Fire,Triumphant Light,A2a,76,Pokémon - Stage 1 - Evolves from Houndour,100,"[{'name': 'Corner', 'cost': ['RC'], 'damage': '60', 'effect': ""During your opponent's next turn, the Defending Pokémon can't retreat.""}]",Water,2,matazo,"If you are burned by the flames it shoots from its mouth, the pain will never go away.",https://limitlesstcg.nyc3.cdn.digitaloceanspaces.com/pocket/A2a/A2a_076_EN.webp,☆,Arceus,cards/triumphant-light/76.webp
Marill,Water,Triumphant Light,A2a,77,Pokémon - Basic,60,"[{'name': 'Water Gun', 'cost': ['W'], 'damage': '20', 'effect': ''}]",Lightning,1,Taiga Kayama,The fur on its body naturally repels water. It can stay dry even when it plays in the water.,https://limitlesstcg.nyc3.cdn.digitaloceanspaces.com/pocket/A2a/A2a_077_EN.webp,☆,Arceus,cards/triumphant-light/77.webp
Unown,Psychic,Triumphant Light,A2a,78,Pokémon - Basic,60,"[{'name': 'Hidden Power', 'cost': ['C'], 'damage': '20', 'effect': ''}]",Darkness,1,IKEDA Saki,"Its flat, thin body is always stuck on walls. Its shape appears to have some meaning.",https://limitlesstcg.nyc3.cdn.digitaloceanspaces.com/pocket/A2a/A2a_078_EN.webp,☆,Arceus,cards/triumphant-light/78.webp
Sudowoodo,Fighting,Triumphant Light,A2a,79,Pokémon - Basic,80,"[{'name': 'Fighting Headbutt', 'cost': ['F'], 'damage': '20+', 'effect': ""If your opponent's Active Pokémon is a Pokémon ex, this attack does 30 more damage.""}]",Grass,2,Yuriko Akase,"Although it always pretends to be a tree, its composition appears more similar to rock than to vegetation.",https://limitlesstcg.nyc3.cdn.digitaloceanspaces.com/pocket/A2a/A2a_079_EN.webp,☆,Arceus,cards/triumphant-light/79.webp
Magnemite,Metal,Triumphant Light,A2a,80,Pokémon - Basic,60,"[{'name': 'Tackle', 'cost': ['M'], 'damage': '20', 'effect': ''}]",Fire,1,Yukihiro Tada,"The electromagnetic waves emitted by the units at the sides of its head expel antigravity, which allows it to float.",https://limitlesstcg.nyc3.cdn.digitaloceanspaces.com/pocket/A2a/A2a_080_EN.webp,☆,Arceus,cards/triumphant-light/80.webp
Shaymin,Colorless,Triumphant Light,A2a,81,Pokémon - Basic,70,"[{'name': 'Flap', 'cost': ['CC'], 'damage': '30', 'effect': ''}]",Lightning,1,MINAMINAMI Take,It can dissolve toxins in the air to instantly transform ruined land into a lush field of flowers.,https://limitlesstcg.nyc3.cdn.digitaloceanspaces.com/pocket/A2a/A2a_081_EN.webp,☆,Arceus,cards/triumphant-light/81.webp
Leafeon ex,Grass,Triumphant Light,A2a,82,Pokémon - Stage 1 - Evolves from Eevee,140,"[{'name': 'Solar Beam', 'cost': ['GCC'], 'damage': '70', 'effect': ''}]",Fire,1,PLANETA CG Works,,https://limitlesstcg.nyc3.cdn.digitaloceanspaces.com/pocket/A2a/A2a_082_EN.webp,☆☆,Arceus,cards/triumphant-light/82.webp
Glaceon ex,Water,Triumphant Light,A2a,83,Pokémon - Stage 1 - Evolves from Eevee,140,"[{'name': 'Freezing Wind', 'cost': ['WWC'], 'damage': '90', 'effect': ''}]",Metal,1,PLANETA CG Works,,https://limitlesstcg.nyc3.cdn.digitaloceanspaces.com/pocket/A2a/A2a_083_EN.webp,☆☆,Arceus,cards/triumphant-light/83.webp
Garchomp ex,Fighting,Triumphant Light,A2a,84,Pokémon - Stage 2 - Evolves from Gabite,170,"[{'name': 'Linear Attack', 'cost': ['F'], 'damage': '0', 'effect': ""This attack does 50 damage to 1 of your opponent's Pokémon.""}, {'name': 'Dragon Claw', 'cost': ['FFC'], 'damage': '100', 'effect': ''}]",Grass,1,PLANETA CG Works,,https://limitlesstcg.nyc3.cdn.digitaloceanspaces.com/pocket/A2a/A2a_084_EN.webp,☆☆,Arceus,cards/triumphant-light/84.webp
Probopass ex,Metal,Triumphant Light,A2a,85,Pokémon - Stage 1 - Evolves from Nosepass,160,"[{'name': 'Defensive Unit', 'cost': ['MMC'], 'damage': '90', 'effect': ""During your opponent's next turn, this Pokémon takes −20 damage from attacks.""}]",Fire,3,PLANETA Tsuji,,https://limitlesstcg.nyc3.cdn.digitaloceanspaces.com/pocket/A2a/A2a_085_EN.webp,☆☆,Arceus,cards/triumphant-light/85.webp
Arceus ex,Colorless,Triumphant Light,A2a,86,Pokémon - Basic,140,"[{'name': 'Ultimate Force', 'cost': ['CCC'], 'damage': '70+', 'effect': 'This attack does 20 more damage for each of your Benched Pokémon.'}]",Fighting,2,PLANETA CG Works,,https://limitlesstcg.nyc3.cdn.digitaloceanspaces.com/pocket/A2a/A2a_086_EN.webp,☆☆,Arceus,cards/triumphant-light/86.webp
Irida,,Triumphant Light,A2a,87,Trainer - Supporter,,"[{'name': 'Effect', 'cost': [], 'damage': '', 'effect': 'Heal 40 damage from each of your Pokémon that has any[W]Energy attached. Illustrated byAtsushi Furusawa'}]",,,Atsushi Furusawa,,https://limitlesstcg.nyc3.cdn.digitaloceanspaces.com/pocket/A2a/A2a_087_EN.webp,☆☆,Arceus,cards/triumphant-light/87.webp
Celestic Town Elder,,Triumphant Light,A2a,88,Trainer - Supporter,,"[{'name': 'Effect', 'cost': [], 'damage': '', 'effect': 'Put 1 random Basic Pokémon from your discard pile into your hand. Illustrated byYuu Nishida'}]",,,Yuu Nishida,,https://limitlesstcg.nyc3.cdn.digitaloceanspaces.com/pocket/A2a/A2a_088_EN.webp,☆☆,Arceus,cards/triumphant-light/88.webp
Barry,,Triumphant Light,A2a,89,Trainer - Supporter,,"[{'name': 'Effect', 'cost': [], 'damage': '', 'effect': 'During this turn, attacks used by your Snorlax, Heracross, and Staraptor cost 2 less[C]Energy. Illustrated byHideki Ishikawa'}]",,,Hideki Ishikawa,,https://limitlesstcg.nyc3.cdn.digitaloceanspaces.com/pocket/A2a/A2a_089_EN.webp,☆☆,Arceus,cards/triumphant-light/89.webp
Adaman,,Triumphant Light,A2a,90,Trainer - Supporter,,"[{'name': 'Effect', 'cost': [], 'damage': '', 'effect': ""During your opponent's next turn, all of your[M]Pokémon take −20 damage from attacks from your opponent's Pokémon. Illustrated byakagi""}]",,,akagi,,https://limitlesstcg.nyc3.cdn.digitaloceanspaces.com/pocket/A2a/A2a_090_EN.webp,☆☆,Arceus,cards/triumphant-light/90.webp
Leafeon ex,Grass,Triumphant Light,A2a,91,Pokémon - Stage 1 - Evolves from Eevee,140,"[{'name': 'Solar Beam', 'cost': ['GCC'], 'damage': '70', 'effect': ''}]",Fire,1,saino misaki,,https://limitlesstcg.nyc3.cdn.digitaloceanspaces.com/pocket/A2a/A2a_091_EN.webp,☆☆,Arceus,cards/triumphant-light/91.webp
Glaceon ex,Water,Triumphant Light,A2a,92,Pokémon - Stage 1 - Evolves from Eevee,140,"[{'name': 'Freezing Wind', 'cost': ['WWC'], 'damage': '90', 'effect': ''}]",Metal,1,rika,,https://limitlesstcg.nyc3.cdn.digitaloceanspaces.com/pocket/A2a/A2a_092_EN.webp,☆☆,Arceus,cards/triumphant-light/92.webp
Garchomp ex,Fighting,Triumphant Light,A2a,93,Pokémon - Stage 2 - Evolves from Gabite,170,"[{'name': 'Linear Attack', 'cost': ['F'], 'damage': '0', 'effect': ""This attack does 50 damage to 1 of your opponent's Pokémon.""}, {'name': 'Dragon Claw', 'cost': ['FFC'], 'damage': '100', 'effect': ''}]",Grass,1,toriyufu,,https://limitlesstcg.nyc3.cdn.digitaloceanspaces.com/pocket/A2a/A2a_093_EN.webp,☆☆,Arceus,cards/triumphant-light/93.webp
Probopass ex,Metal,Triumphant Light,A2a,94,Pokémon - Stage 1 - Evolves from Nosepass,160,"[{'name': 'Defensive Unit', 'cost': ['MMC'], 'damage': '90', 'effect': ""During your opponent's next turn, this Pokémon takes −20 damage from attacks.""}]",Fire,3,Masa,,https://limitlesstcg.nyc3.cdn.digitaloceanspaces.com/pocket/A2a/A2a_094_EN.webp,☆☆,Arceus,cards/triumphant-light/94.webp
Arceus ex,Colorless,Triumphant Light,A2a,95,Pokémon - Basic,140,"[{'name': 'Ultimate Force', 'cost': ['CCC'], 'damage': '70+', 'effect': 'This attack does 20 more damage for each of your Benched Pokémon.'}]",Fighting,2,Takumi Wada,,https://limitlesstcg.nyc3.cdn.digitaloceanspaces.com/pocket/A2a/A2a_095_EN.webp,☆☆☆,Arceus,cards/triumphant-light/95.webp
Arceus ex,Colorless,Triumphant Light,A2a,96,Pokémon - Basic,140,"[{'name': 'Ultimate Force', 'cost': ['CCC'], 'damage': '70+', 'effect': 'This attack does 20 more damage for each of your Benched Pokémon.'}]",Fighting,2,PLANETA CG Works,,https://limitlesstcg.nyc3.cdn.digitaloceanspaces.com/pocket/A2a/A2a_096_EN.webp,Crown Rare,Arceus,cards/triumphant-light/96.webp
Oddish,Grass,Space-Time Smackdown,A2,1,Pokémon - Basic,60,"[{'name': 'Blot', 'cost': ['G'], 'damage': '10', 'effect': 'Heal 10 damage from this Pokémon.'}]",Fire,1,Asako Ito,"If exposed to moonlight, it starts to move. It roams far and wide at night to scatter its seeds.",https://limitlesstcg.nyc3.cdn.digitaloceanspaces.com/pocket/A2/A2_001_EN.webp,◊,,cards/space-time-smackdown/1.webp
Gloom,Grass,Space-Time Smackdown,A2,2,Pokémon - Stage 1 - Evolves from Oddish,80,"[{'name': 'Razor Leaf', 'cost': ['G'], 'damage': '30', 'effect': ''}]",Fire,2,Shibuzoh.,Its pistils exude an incredibly foul odor. The horrid stench can cause fainting at a distance of 1.25 miles.,https://limitlesstcg.nyc3.cdn.digitaloceanspaces.com/pocket/A2/A2_002_EN.webp,◊,,cards/space-time-smackdown/2.webp
Bellossom,Grass,Space-Time Smackdown,A2,3,Pokémon - Stage 2 - Evolves from Gloom,130,"[{'name': 'Leaf Step', 'cost': ['GG'], 'damage': '80', 'effect': ''}]",Fire,1,Naoyo Kimura,"Plentiful in the tropics. When it dances, its petals rub together and make a pleasant ringing sound.",https://limitlesstcg.nyc3.cdn.digitaloceanspaces.com/pocket/A2/A2_003_EN.webp,◊◊,,cards/space-time-smackdown/3.webp
Tangela,Grass,Space-Time Smackdown,A2,4,Pokémon - Basic,70,"[{'name': 'Vine Whip', 'cost': ['GC'], 'damage': '30', 'effect': ''}]",Fire,1,Narumi Sato,"Hidden beneath a tangle of vines that grows nonstop even if the vines are torn off, this Pokémon’s true appearance remains a mystery.",https://limitlesstcg.nyc3.cdn.digitaloceanspaces.com/pocket/A2/A2_004_EN.webp,◊,Dialga,cards/space-time-smackdown/4.webp
Tangrowth,Grass,Space-Time Smackdown,A2,5,Pokémon - Stage 1 - Evolves from Tangela,130,"[{'name': 'Mega Drain', 'cost': ['GGGC'], 'damage': '90', 'effect': 'Heal 30 damage from this Pokémon.'}]",Fire,3,kodama,"Tangrowth has two arms that it can extend as it pleases. Recent research has shown that these arms are, in fact, bundles of vines.",https://limitlesstcg.nyc3.cdn.digitaloceanspaces.com/pocket/A2/A2_005_EN.webp,◊◊,Dialga,cards/space-time-smackdown/5.webp
Yanma,Grass,Space-Time Smackdown,A2,6,Pokémon - Basic,50,"[{'name': 'Flap', 'cost': ['C'], 'damage': '20', 'effect': ''}]",Lightning,1,Eri Yamaki,Its eyes can see 360 degrees without moving its head. It won’t miss prey—even those behind it.,https://limitlesstcg.nyc3.cdn.digitaloceanspaces.com/pocket/A2/A2_006_EN.webp,◊,Dialga,cards/space-time-smackdown/6.webp
Yanmega ex,Grass,Space-Time Smackdown,A2,7,Pokémon - Stage 1 - Evolves from Yanma,140,"[{'name': 'Air Slash', 'cost': ['CCC'], 'damage': '120', 'effect': 'Discard a random Energy from this Pokémon.'}]",Lightning,1,PLANETA Tsuji,,https://limitlesstcg.nyc3.cdn.digitaloceanspaces.com/pocket/A2/A2_007_EN.webp,◊◊◊◊,Dialga,cards/space-time-smackdown/7.webp
Roselia,Grass,Space-Time Smackdown,A2,8,Pokémon - Basic,70,"[{'name': 'Sting', 'cost': ['G'], 'damage': '20', 'effect': ''}]",Fire,1,kirisAki,"Its flowers give off a relaxing fragrance. The stronger its aroma, the healthier the Roselia is.",https://limitlesstcg.nyc3.cdn.digitaloceanspaces.com/pocket/A2/A2_008_EN.webp,◊,,cards/space-time-smackdown/8.webp
Roserade,Grass,Space-Time Smackdown,A2,9,Pokémon - Stage 1 - Evolves from Roselia,100,"[{'name': 'Poisonous Whip', 'cost': ['GC'], 'damage': '50', 'effect': ""Your opponent's Active Pokémon is now Poisoned.""}]",Fire,2,Masakazu Fukuda,"After captivating opponents with its sweet scent, it lashes them with its thorny whips.",https://limitlesstcg.nyc3.cdn.digitaloceanspaces.com/pocket/A2/A2_009_EN.webp,◊◊,,cards/space-time-smackdown/9.webp
Turtwig,Grass,Space-Time Smackdown,A2,10,Pokémon - Basic,80,"[{'name': 'Bite', 'cost': ['GC'], 'damage': '30', 'effect': ''}]",Fire,2,OOYAMA,It uses its whole body to photosynthesize when exposed to sunlight. Its shell is made from hardened soil.,https://limitlesstcg.nyc3.cdn.digitaloceanspaces.com/pocket/A2/A2_010_EN.webp,◊,Palkia,cards/space-time-smackdown/10.webp
Grotle,Grass,Space-Time Smackdown,A2,11,Pokémon - Stage 1 - Evolves from Turtwig,100,"[{'name': 'Razor Leaf', 'cost': ['GGC'], 'damage': '60', 'effect': ''}]",Fire,3,Sumiyoshi Kizuki,"It lives along water in forests. In the daytime, it leaves the forest to sunbathe its treed shell.",https://limitlesstcg.nyc3.cdn.digitaloceanspaces.com/pocket/A2/A2_011_EN.webp,◊◊,Palkia,cards/space-time-smackdown/11.webp
Torterra,Grass,Space-Time Smackdown,A2,12,Pokémon - Stage 2 - Evolves from Grotle,160,"[{'name': 'Frenzy Plant', 'cost': ['GGCC'], 'damage': '150', 'effect': ""During your next turn, this Pokémon can't use Frenzy Plant.""}]",Fire,4,kawayoo,Ancient people imagined that beneath the ground dwelt a gigantic Torterra.,https://limitlesstcg.nyc3.cdn.digitaloceanspaces.com/pocket/A2/A2_012_EN.webp,◊◊◊,Palkia,cards/space-time-smackdown/12.webp
Kricketot,Grass,Space-Time Smackdown,A2,13,Pokémon - Basic,60,"[{'name': 'Bug Bite', 'cost': ['G'], 'damage': '20', 'effect': ''}]",Fire,1,Shigenori Negishi,"Its legs are short. Whenever it stumbles, its stiff antennae clack with a xylophone-like sound.",https://limitlesstcg.nyc3.cdn.digitaloceanspaces.com/pocket/A2/A2_013_EN.webp,◊,Palkia,cards/space-time-smackdown/13.webp
Kricketune,Grass,Space-Time Smackdown,A2,14,Pokémon - Stage 1 - Evolves from Kricketot,90,"[{'name': 'Entrancing Melody', 'cost': ['GC'], 'damage': '50', 'effect': ""Your opponent's Active Pokémon is now Confused.""}]",Fire,1,Naoyo Kimura,"By allowing its cry to resonate in the hollow of its belly, it produces a captivating sound.",https://limitlesstcg.nyc3.cdn.digitaloceanspaces.com/pocket/A2/A2_014_EN.webp,◊,Palkia,cards/space-time-smackdown/14.webp
Burmy,Grass,Space-Time Smackdown,A2,15,Pokémon - Basic,60,"[{'name': 'Tackle', 'cost': ['C'], 'damage': '10', 'effect': ''}]",Fire,1,Mugi Hamada,"To shelter itself from cold, wintry winds, it covers itself with a cloak made of twigs and leaves.",https://limitlesstcg.nyc3.cdn.digitaloceanspaces.com/pocket/A2/A2_015_EN.webp,◊,,cards/space-time-smackdown/15.webp
Wormadam,Grass,Space-Time Smackdown,A2,16,Pokémon - Stage 1 - Evolves from Burmy,120,"[{'name': 'Leaf Cutter', 'cost': ['GCC'], 'damage': '60+', 'effect': 'Flip a coin. If heads, this attack does 30 more damage.'}]",Fire,2,Kouki Saitou,Its appearance changes depending on where it evolved. The materials on hand become a part of its body.,https://limitlesstcg.nyc3.cdn.digitaloceanspaces.com/pocket/A2/A2_016_EN.webp,◊,,cards/space-time-smackdown/16.webp
Combee,Grass,Space-Time Smackdown,A2,17,Pokémon - Basic,50,"[{'name': 'Call for Family', 'cost': ['C'], 'damage': '0', 'effect': 'Put 1 random Basic Pokémon from your deck onto your Bench.'}]",Fire,1,Yukiko Baba,"At night, Combee sleep in a group of about a hundred, packed closely together in a lump.",https://limitlesstcg.nyc3.cdn.digitaloceanspaces.com/pocket/A2/A2_017_EN.webp,◊,Dialga,cards/space-time-smackdown/17.webp
Vespiquen,Grass,Space-Time Smackdown,A2,18,Pokémon - Stage 1 - Evolves from Combee,100,"[{'name': 'Pierce', 'cost': ['GG'], 'damage': '70', 'effect': ''}]",Fire,2,chibi,It houses its colony in cells in its body and releases various pheromones to make those grubs do its bidding.,https://limitlesstcg.nyc3.cdn.digitaloceanspaces.com/pocket/A2/A2_018_EN.webp,◊◊,Dialga,cards/space-time-smackdown/18.webp
Carnivine,Grass,Space-Time Smackdown,A2,19,Pokémon - Basic,90,"[{'name': 'Flog', 'cost': ['GGC'], 'damage': '40+', 'effect': 'Flip a coin. If heads, this attack does 50 more damage.'}]",Fire,1,Anesaki Dynamic,"It attracts prey with its sweet-smelling saliva, then chomps down. It takes a whole day to eat prey.",https://limitlesstcg.nyc3.cdn.digitaloceanspaces.com/pocket/A2/A2_019_EN.webp,◊◊,Palkia,cards/space-time-smackdown/19.webp
Leafeon,Grass,Space-Time Smackdown,A2,20,Pokémon - Stage 1 - Evolves from Eevee,90,"[{'name': 'Leafy Cyclone', 'cost': ['GC'], 'damage': '90', 'effect': ""During your next turn, this Pokémon can't attack.""}]",Fire,1,Kouki Saitou,"When you see Leafeon asleep in a patch of sunshine, you’ll know it is using photosynthesis to produce clean air.",https://limitlesstcg.nyc3.cdn.digitaloceanspaces.com/pocket/A2/A2_020_EN.webp,◊◊◊,Dialga,cards/space-time-smackdown/20.webp
Mow Rotom,Grass,Space-Time Smackdown,A2,21,Pokémon - Basic,80,"[{'name': 'Energy Cutoff', 'cost': ['GC'], 'damage': '30', 'effect': ""Flip a coin. If heads, discard a random Energy from your opponent's Active Pokémon.""}]",Fire,1,kawayoo,The lawn mower is one of the household appliances that led to the development of the Rotom Dex.,https://limitlesstcg.nyc3.cdn.digitaloceanspaces.com/pocket/A2/A2_021_EN.webp,◊,,cards/space-time-smackdown/21.webp
Shaymin,Grass,Space-Time Smackdown,A2,22,Pokémon - Basic,60,"[{'name': 'Flop', 'cost': ['GC'], 'damage': '30', 'effect': ''}]",Fire,1,Narumi Sato,It can dissolve toxins in the air to instantly transform ruined land into a lush field of flowers.,https://limitlesstcg.nyc3.cdn.digitaloceanspaces.com/pocket/A2/A2_022_EN.webp,◊◊◊,Dialga,cards/space-time-smackdown/22.webp
Magmar,Fire,Space-Time Smackdown,A2,23,Pokémon - Basic,80,"[{'name': 'Stoke', 'cost': ['R'], 'damage': '0', 'effect': 'Take a [R] Energy from your Energy Zone and attach it to this Pokémon.'}]",Water,2,Hiroki Asanuma,Magmar dispatches its prey with fire. But it regrets this habit once it realizes that it has burned its intended prey to a charred crisp.,https://limitlesstcg.nyc3.cdn.digitaloceanspaces.com/pocket/A2/A2_023_EN.webp,◊,Palkia,cards/space-time-smackdown/23.webp
Magmortar,Fire,Space-Time Smackdown,A2,24,Pokémon - Stage 1 - Evolves from Magmar,130,"[{'name': 'Bursting Inferno', 'cost': ['RRRR'], 'damage': '100', 'effect': ""Your opponent's Active Pokémon is now Burned.""}]",Water,3,KEIICHIRO ITO,"When Magmortar inhales deeply, the fire burning in its belly intensifies, rising in temperature to over 3,600 degrees Fahrenheit.",https://limitlesstcg.nyc3.cdn.digitaloceanspaces.com/pocket/A2/A2_024_EN.webp,◊◊◊,Palkia,cards/space-time-smackdown/24.webp
Slugma,Fire,Space-Time Smackdown,A2,25,Pokémon - Basic,70,"[{'name': 'Flare', 'cost': ['R'], 'damage': '20', 'effect': ''}]",Water,2,Naoyo Kimura,"A common sight in volcanic areas, it slowly slithers around in a constant search for warm places.",https://limitlesstcg.nyc3.cdn.digitaloceanspaces.com/pocket/A2/A2_025_EN.webp,◊,,cards/space-time-smackdown/25.webp
Magcargo,Fire,Space-Time Smackdown,A2,26,Pokémon - Stage 1 - Evolves from Slugma,120,"[{'name': 'Searing Flame', 'cost': ['RC'], 'damage': '30', 'effect': ""Your opponent's Active Pokémon is now Burned.""}]",Water,3,Oswaldo KATO,Its brittle shell occasionally spouts intense flames that circulate throughout its body.,https://limitlesstcg.nyc3.cdn.digitaloceanspaces.com/pocket/A2/A2_026_EN.webp,◊◊,,cards/space-time-smackdown/26.webp
Chimchar,Fire,Space-Time Smackdown,A2,27,Pokémon - Basic,60,"[{'name': 'Scratch', 'cost': ['R'], 'damage': '20', 'effect': ''}]",Water,1,Kagemaru Himeno,Its fiery rear end is fueled by gas made in its belly. Even rain can’t extinguish the fire.,https://limitlesstcg.nyc3.cdn.digitaloceanspaces.com/pocket/A2/A2_027_EN.webp,◊,Palkia,cards/space-time-smackdown/27.webp
Monferno,Fire,Space-Time Smackdown,A2,28,Pokémon - Stage 1 - Evolves from Chimchar,80,"[{'name': 'Fiery Punch', 'cost': ['R'], 'damage': '30', 'effect': ''}]",Water,1,Masakazu Fukuda,It skillfully controls the intensity of the fire on its tail to keep its foes at an ideal distance.,https://limitlesstcg.nyc3.cdn.digitaloceanspaces.com/pocket/A2/A2_028_EN.webp,◊◊,Palkia,cards/space-time-smackdown/28.webp
Infernape ex,Fire,Space-Time Smackdown,A2,29,Pokémon - Stage 2 - Evolves from Monferno,170,"[{'name': 'Flare Blitz', 'cost': ['RR'], 'damage': '140', 'effect': 'Discard all [R] Energy from this Pokémon.'}]",Water,0,PLANETA CG Works,,https://limitlesstcg.nyc3.cdn.digitaloceanspaces.com/pocket/A2/A2_029_EN.webp,◊◊◊◊,Palkia,cards/space-time-smackdown/29.webp
Heat Rotom,Fire,Space-Time Smackdown,A2,30,Pokémon - Basic,80,"[{'name': 'Heat Breath', 'cost': ['RC'], 'damage': '30+', 'effect': 'Flip a coin. If heads, this attack does 30 more damage.'}]",Water,1,Kedamahadaitai Yawarakai,"If the convection microwave oven is not working properly, then the Rotom inhabiting it will become lethargic.",https://limitlesstcg.nyc3.cdn.digitaloceanspaces.com/pocket/A2/A2_030_EN.webp,◊,,cards/space-time-smackdown/30.webp
Swinub,Water,Space-Time Smackdown,A2,31,Pokémon - Basic,60,"[{'name': 'Headbutt', 'cost': ['WC'], 'damage': '40', 'effect': ''}]",Metal,2,Eri Yamaki,It rubs its snout on the ground to find and dig up food. It sometimes discovers hot springs.,https://limitlesstcg.nyc3.cdn.digitaloceanspaces.com/pocket/A2/A2_031_EN.webp,◊,Dialga,cards/space-time-smackdown/31.webp
Piloswine,Water,Space-Time Smackdown,A2,32,Pokémon - Stage 1 - Evolves from Swinub,110,"[{'name': 'Hammer In', 'cost': ['WWC'], 'damage': '60', 'effect': ''}]",Metal,3,Suwama Chiaki,"If it charges at an enemy, the hairs on its back stand up straight. It is very sensitive to sound.",https://limitlesstcg.nyc3.cdn.digitaloceanspaces.com/pocket/A2/A2_032_EN.webp,◊◊,Dialga,cards/space-time-smackdown/32.webp
Mamoswine,Water,Space-Time Smackdown,A2,33,Pokémon - Stage 2 - Evolves from Piloswine,160,"[{'name': 'Frosty Flattening', 'cost': ['WWCC'], 'damage': '120', 'effect': ''}]",Metal,4,match,"This Pokémon can be spotted in wall paintings from as far back as 10,000 years ago. For a while, it was thought to have gone extinct.",https://limitlesstcg.nyc3.cdn.digitaloceanspaces.com/pocket/A2/A2_033_EN.webp,◊◊◊,Dialga,cards/space-time-smackdown/33.webp
Regice,Water,Space-Time Smackdown,A2,34,Pokémon - Basic,110,"[{'name': 'Frost Smash', 'cost': ['WW'], 'damage': '50', 'effect': ''}]",Metal,2,Tomokazu Komiya,"With cold air that can reach temperatures as low as −328 degrees Fahrenheit, Regice instantly freezes any creature that approaches it.",https://limitlesstcg.nyc3.cdn.digitaloceanspaces.com/pocket/A2/A2_034_EN.webp,◊◊,Palkia,cards/space-time-smackdown/34.webp
Piplup,Water,Space-Time Smackdown,A2,35,Pokémon - Basic,60,"[{'name': 'Nap', 'cost': ['C'], 'damage': '0', 'effect': 'Heal 20 damage from this Pokémon.'}]",Lightning,1,Hajime Kusajima,It doesn’t like to be taken care of. It’s difficult to bond with since it won’t listen to its Trainer.,https://limitlesstcg.nyc3.cdn.digitaloceanspaces.com/pocket/A2/A2_035_EN.webp,◊,Palkia,cards/space-time-smackdown/35.webp
Prinplup,Water,Space-Time Smackdown,A2,36,Pokémon - Stage 1 - Evolves from Piplup,90,"[{'name': 'Surf', 'cost': ['WC'], 'damage': '30', 'effect': ''}]",Lightning,1,Mizue,"It lives alone, away from others. Apparently, every one of them believes it is the most important.",https://limitlesstcg.nyc3.cdn.digitaloceanspaces.com/pocket/A2/A2_036_EN.webp,◊◊,Palkia,cards/space-time-smackdown/36.webp
Empoleon,Water,Space-Time Smackdown,A2,37,Pokémon - Stage 2 - Evolves from Prinplup,150,"[{'name': 'Aqua Jet', 'cost': ['WWC'], 'damage': '80', 'effect': ""This attack also does 30 damage to 1 of your opponent's Benched Pokémon.""}]",Lightning,2,Satoshi Shirai,It swims as fast as a jet boat. The edges of its wings are sharp and can slice apart drifting ice.,https://limitlesstcg.nyc3.cdn.digitaloceanspaces.com/pocket/A2/A2_037_EN.webp,◊◊◊,Palkia,cards/space-time-smackdown/37.webp
Buizel,Water,Space-Time Smackdown,A2,38,Pokémon - Basic,60,"[{'name': 'Water Gun', 'cost': ['W'], 'damage': '20', 'effect': ''}]",Lightning,1,OKUBO,It spins its two tails like a screw to propel itself through water. The tails also slice clinging seaweed.,https://limitlesstcg.nyc3.cdn.digitaloceanspaces.com/pocket/A2/A2_038_EN.webp,◊,,cards/space-time-smackdown/38.webp
Floatzel,Water,Space-Time Smackdown,A2,39,Pokémon - Stage 1 - Evolves from Buizel,90,"[{'name': 'Jet Screw', 'cost': ['W'], 'damage': '30+', 'effect': 'Flip a coin. If heads, this attack does 30 more damage.'}]",Lightning,1,Kanako Eo,"With its flotation sac inflated, it can carry people on its back. It deflates the sac before it dives.",https://limitlesstcg.nyc3.cdn.digitaloceanspaces.com/pocket/A2/A2_039_EN.webp,◊◊,,cards/space-time-smackdown/39.webp
Shellos,Water,Space-Time Smackdown,A2,40,Pokémon - Basic,70,"[{'name': 'Mud-Slap', 'cost': ['WC'], 'damage': '30', 'effect': ''}]",Lightning,2,Teeziro,It used to have a shell on its back long ago. This species is closely related to Pokémon like Shellder.,https://limitlesstcg.nyc3.cdn.digitaloceanspaces.com/pocket/A2/A2_040_EN.webp,◊,Palkia,cards/space-time-smackdown/40.webp
